{"acceptance_criteria":[{"criterion_id":"all-analyses-human-disposed","observed":"2 disposed analyses","passed":true,"threshold":"2 disposed analyses"},{"criterion_id":"declared-fixture-classification-correct","observed":"tp=1,tn=1,fp=0,fn=0","passed":true,"threshold":"declared truth with zero false positives and false negatives"},{"criterion_id":"two-run-deterministic-equivalence","observed":"two identical pre-publication execution hashes","passed":true,"threshold":"2 identical execution hashes at tolerance 0"}],"classification_metrics":{"accuracy":1.0,"f1":1.0,"false_negative":0,"false_negative_rate":0.0,"false_positive":0,"false_positive_rate":0.0,"precision":1.0,"recall":1.0,"specificity":1.0,"true_negative":1,"true_positive":1},"configuration_sha256":"0a6d7cdf32feeed5aa54b16018af5519adb4a2fa9188f86c259969b88b5129b8","dataset":{"dataset_id":"case-dataset-case-MVS-DEMO-001","dataset_version":"1.0.0","license_id":"local-user-or-synthetic-demo","manifest_sha256":"eb14dd88e1c294fcb53aa1ea44331cdf8aaea981c70fbca7e860e7e7d16897b0","negative_count":1,"positive_count":1,"sample_count":2},"evaluation_run_id":"run-case-MVS-DEMO-001-8","failure_counts":[],"generated_at":"2026-07-31T11:40:23.345Z","limitations":["Synthetic demo baseline only; not validated for production inspection.","No labeled benchmark ground truth was evaluated in this case export."],"model":{"model_artifact_sha256":"fb11440ef8cf47e64e17f5f41d50993bab1a386d9ed465f5ac5d49eae26925f8","model_id":"registered-absolute-difference","model_version":"1.0.0"},"pipeline":{"pipeline_id":"registered-difference","pipeline_version":"1.0.0"},"report_id":"eval-case-MVS-DEMO-001-8","reproducibility":{"equivalent":true,"metric_tolerance":0.0,"repeat_count":2,"run_result_sha256s":["6229360abdd119465c08ea9a281e9d13d5f2c64cdb92819997adf1b2235a50d9","6229360abdd119465c08ea9a281e9d13d5f2c64cdb92819997adf1b2235a50d9"]},"schema_version":"1.0.0","segmentation_metrics":{"evaluated_mask_count":0,"mean_dice":null,"mean_iou":null},"verdict":"pass"}